pmid,title,abstract,pub_year,journal,toxicant,organs,health_effects,products,ingredients,inference,relevant,relevance_reason
34883208,Formulation of acyclovir (core)-dexpanthenol (sheath) nanofibrous patches for the treatment of herpes labialis.,"Topically applied antiviral creams and patches are the commercially available options for the treatment of herpes labialis. The nanofibrous patches could be a new direction in the formulation. The project aimed to formulate core-shell type nanofibrous scaffolds loaded with dexpanthenol (shell) and acyclovir (core). To achieve the fast dissolution of the antiviral agent, hydroxypropyl-beta-cyclodextrin was used as a complexation agent. The further aim was to study the prepared electrospun scaffolds' morphological- and physicochemical properties and antiviral activity. The fibrous samples were prepared by electrospinning using polyvinylpyrrolidone (PVP) as a shell, hypromellose (HPMC), and poly(ethylene oxide)(PEO) composite or poly(vinyl alcohol) (PVA) as a core polymer. The morphology of the prepared sample was studied by scanning electron microscopy (SEM), transmission electron microscopy (TEM), and Raman spectroscopy. The SEM photos showed that fibrous structures were obtained. In the case of the PVA/PVP composition, the desired structure was obtained. While when HPMC-PEO was used as a core, the core-shell structure could not be observed. The Raman measurements revealed the mixed fibre structure of this sample. All of the fibrous samples released about 100% of acyclovir and also the dexpanthenol within 20 min. Coaxially electrospun fibres of different compositions were successfully prepared with various structural homogeneities, furthermore, a better antiviral activity could be achieved compared to the commercially available Zovirax cream.",2022,International journal of pharmaceutics,dioxane,unspecified,unspecified,unspecified,unspecified,skin/topical study,,
34477495,Analysis of ethylene oxide in ice creams manufactured with contaminated carob bean gum (E410).,"Residues of ethylene oxide (EO), a banned fumigant in the EU, were found at amounts above the maximum residue limit (MRL) in carob (locust) bean gum (additive E410). The pesticide entered the food chain via stabiliser blends that are used as minor ingredients in the manufacture of ice cream. Consequently, all products that contained the non-compliant ingredient were withdrawn or recalled in several countries across the EU, in most cases irrespective of whether the pesticide residue was detectable or not in the final product. This is the first report of a reliable method to determine EO and its metabolite/marker compound 2-chloroethanol (2-CE), either together or independently in ice cream, with a limit of quantification at 0.01 mg EO/kg and recovery in the range of 87-104% across the levels investigated (0.01, 0.02 and 0.06 mg EO/kg). The method applies QuEChERS extraction and isotope dilution gas chromatography coupled with tandem mass spectrometry (GC-MS/MS). High resolution mass spectrometry (HRMS) confirmed the specificity of low mass ions. Data on the stability of EO and 2-CE under thermal conditions revealed that 2-CE is relatively stable in an ice cream matrix (ca. 80% recovery of spiked material). Importantly, this study also demonstrates that not EO, but 2-CE is the predominant analyte detected in the contaminated samples, which is new information of significance in terms of the overall risk assessment of EO in foodstuffs.",2021,"Food additives & contaminants. Part A, Chemistry, analysis, control, exposure & risk assessment",dioxane,unspecified,unspecified,unspecified,unspecified,skin/topical study | analytical/method study,,
34468180,"Changes in Latina Women's Exposure to Cleaning Chemicals Associated with Switching from Conventional to ""Green"" Household Cleaning Products: The LUCIR Intervention Study.","Household cleaning products may be a significant source of chemical exposures, including carcinogens and suspected endocrine disruptors. We characterized exposures during routine household cleaning and tested an intervention to reduce exposures to cleaning product chemicals. The Lifting Up Communities with Interventions and Research (LUCIR) Study is a youth-led, community-based intervention project. Youth researchers conducted personal air monitoring with 50 Latina women while they cleaned their homes with their regular cleaning products (preintervention visit) and then 1 week later while they used ""green"" cleaning products provided by the study (postintervention visit). Air samples were analyzed for volatile and semivolatile organic compounds using gas chromatography-mass spectrometry and high-performance liquid chromatography. We compared pre- and postintervention air concentrations of 47 chemicals of concern, selected because they were on California's Proposition 65 list of carcinogens or reproductive/developmental toxicants or were suspected endocrine disruptors. Youth researchers were integrally involved in the study design, data collection, interpretation, and dissemination of findings. We observed statistically significant decreases in air concentrations of 17 chemicals of concern when participants switched to green cleaning products, including decreases in geometric mean concentrations of 1,4-dioxane (<math xmlns=""http://www.w3.org/1998/Math/MathML""><mrow><mo>-</mo><mn>46.4</mn><mo>%</mo></mrow></math>), chloroform (<math xmlns=""http://www.w3.org/1998/Math/MathML""><mrow><mo>-</mo><mn>86.7</mn><mo>%</mo></mrow></math>), benzene (<math xmlns=""http://www.w3.org/1998/Math/MathML""><mrow><mo>-</mo><mn>24.8</mn><mo>%</mo></mrow></math>), naphthalene (<math xmlns=""http://www.w3.org/1998/Math/MathML""><mrow><mo>-</mo><mn>40.3</mn><mo>%</mo></mrow></math>), toluene (<math xmlns=""http://www.w3.org/1998/Math/MathML""><mrow><mo>-</mo><mn>24.2</mn><mo>%</mo></mrow></math>), and hexane (<math xmlns=""http://www.w3.org/1998/Math/MathML""><mrow><mo>-</mo><mn>35.5</mn><mo>%</mo></mrow></math>). We observed significant increases in air concentrations of three fragrance compounds: the plant-derived terpene, beta-myrcene (221.5%), and the synthetic musks celestolide (31.0%) and galaxolide (79.6%). Almost all participants (98%) said the replacement products worked as well as their original products, and 90% said that they would consider buying the replacement products in the future. This study demonstrates that choosing cleaning products that are marketed as green may reduce exposure to several carcinogens and endocrine disruptors. Future studies should determine whether use of unscented green products would further reduce exposure to terpenes and musks. https://doi.org/10.1289/EHP8831.",2021,Environmental health perspectives,dioxane,unspecified,endocrine disruption | carcinogenicity,unspecified,unspecified,analytical/method study,,
33989995,Evaluation of drug-likeness and ADME properties of sunscreens and preservatives using reversed-phase thin layer chromatographic retention data and calculated descriptors.,"RP-18 TLC chromatography was used to evaluate the pharmacokinetic properties (volume of distribution, V<sub>D</sub>; plasma protein binding, %PPB; the ability to cross the blood-brain barrier expressed as log PS and log BB) of several cosmetic raw materials - sunscreen and preservatives. The majority of these compounds are intended for topical use on skin and their drug-likeness and the ability to cross biological barriers are undesired. The retention parameters R<sub>M</sub><sup>0</sup>, S, PC<sub>1</sub> and R<sub>M</sub><sup>75 %</sup> obtained for mobile phases containing six organic modifiers (methanol, acetonitrile, THF, acetone, dioxane, DMF) were used as the sole descriptors or combined with calculated physicochemical properties (PSA, M<sub>W</sub>, V<sub>M</sub>) of studied compounds. The chromatographic parameters considered in this study are, generally speaking, good predictors of the compounds' pharmacokinetic properties V<sub>D</sub>, %PPB and log PS. R<sub>M</sub><sup>75 %</sup> and the novel parameters derived from it (R<sub>M</sub><sup>75 %</sup>/M<sub>W</sub> and R<sub>M</sub><sup>75 %</sup>/V<sub>M</sub>) can be considered time- and cost-effective alternatives to the chromatographic parameters obtained by extrapolation or interpolation methods. In the case of some pharmacokinetic properties investigated in this study additional descriptors (PSA) have a significant influence on the quality of correlations.",2021,Journal of pharmaceutical and biomedical analysis,dioxane,skin | brain | blood,unspecified,sunscreen,unspecified,cosmetics product study | sunscreen/UV filter study | skin/topical study | analytical/method study,,
33873066,RP-18 TLC retention data and calculated physico-chemical parameters as predictors of soil-water partition and bioconcentration of organic sunscreens.,"RP-18 TLC chromatography was used to evaluate the impact on the environment (mobility in soil expressed as soil-water partition coefficient, log K<sub>oc</sub>; bioconcentration factor in aquatic organisms, log BCF) of several cosmetic raw materials - sunscreens, preservatives and vitamins. The retention parameters R<sub>M</sub><sup>0</sup> (R<sub>M</sub> extrapolated to zero concentration of an organic modifier in a mobile phase), S (slope), PC<sub>1</sub> (1st principal component) and R<sub>M</sub><sup>75%</sup> (single TLC run parameter for mobile phases containing 75% (v/v) of an organic modifier) obtained for six organic modifiers (methanol, acetonitrile, THF, acetone, dioxane, DMF) were used as the sole descriptors or combined with calculated physico-chemical properties (PSA - polar surface area; M<sub>W</sub> - molecular weight; V<sub>M</sub> - molar volume) of studied compounds. The chromatographic parameters considered in this study are, generally speaking, good predictors of the compounds' mobility in soil or the affinity for aquatic organisms. The parameters R<sub>M</sub><sup>0</sup>, S and R<sub>M</sub><sup>75%</sup> obtained for THF, dioxane and acetone may be used to investigate even very lipophilic compounds. R<sub>M</sub><sup>75%</sup> is of a little bit limited use but it should be considered a time- and cost-effective alternative to the chromatographic parameters obtained by extrapolation or interpolation methods. In the case of some environmental parameters investigated in this study additional descriptors (PSA) have a significant influence on the quality of correlations.",2021,Chemosphere,dioxane,unspecified,unspecified,sunscreen,unspecified,cosmetics product study | sunscreen/UV filter study | analytical/method study,,
33481298,An overview on the conversion of glycerol to value-added industrial products via chemical and biochemical routes.,"Glycerol is a common by-product of industrial biodiesel syntheses. Due to its properties, availability, and versatility, residual glycerol can be used as a raw material in the production of high value-added industrial inputs and outputs. In particular, products like hydrogen, propylene glycol, acrolein, epichlorohydrin, dioxalane and dioxane, glycerol carbonate, n-butanol, citric acid, ethanol, butanol, propionic acid, (mono-, di-, and triacylglycerols), cynamoil esters, glycerol acetate, benzoic acid, and other applications. In this context, the present study presents a critical evaluation of the innovative technologies based on the use of residual glycerol in different industries, including the pharmaceutical, textile, food, cosmetic, and energy sectors. Chemical and biochemical catalysts in the transformation of residual glycerol are explored, along with the factors to be considered regarding the choice of catalyst route used in the conversion process, aiming at improving the production of these industrial products.",2022,Biotechnology and applied biochemistry,dioxane,unspecified,unspecified,unspecified,glycerin | propylene glycol | citric acid,cosmetics product study | industrial/occupational,,
33465462,"RIFM fragrance ingredient safety assessment, spiro[bicyclo[4.1.0]heptane-2,5'-[1,3]dioxane], 2',2',3,7,7-pentamethyl-, (1α,3α,6α)-, CAS Registry number 121251-67-0.",,2021,Food and chemical toxicology : an international journal published for the British Industrial Biological Research Association,dioxane,unspecified,unspecified,unspecified,unspecified,unclassified,,
32290946,"[Determination of 1, 4-dioxane in aerosol cosmetic by new isotope dilution-headspace gas chromatography-mass spectrometry].","To develop a simple, fast and sensitive analytical method based on isotope dilution-headspace gas chromatography-mass spectrometry for the determination of 1, 4-dioxane residue in the aerosol cosmetics. Sample was successive weighed and dissolved in 1, 3-dimehyl-2-imidazolidinone(DMI)solvent and isotope internal standard was added. Then transfered to a 20 mL headspace vial. The headspace vial was sealed and extracted 15 min by ultrasonic-assisted extraction. After separated by HP-5 MS fused silica capillary column(30 m×25 mm, 0. 25 μm), the compound was analyzed by gas chromatography-mass spectrometry in selected ion monitoring mode(GC-MS-SIM) and quantified by internal standard method. There were good linear correlations with R~2 no less than 0. 999 in the range of 1. 0-100 mg/kg. The limit of detection(LOD) of this method was 0. 3 mg/kg. At 0. 3, 1. 0, 5. 0 and 30 mg/kg four added concentration, recovery for five kinds of aerosol cosmetic were all between 91. 4% and 104. 2%. The relative standard deviations(RSDs) were 1. 5%-6. 3% and 1. 7%-6. 4%(n=6), respectively. The developed method has proved convenient, time-saving, accurate and sensitive and suited for determination 1, 4-dioxane in aerosol cosmetic.",2020,Wei sheng yan jiu = Journal of hygiene research,dioxane,unspecified,unspecified,unspecified,unspecified,cosmetics product study | analytical/method study,,
32251326,"Solvent extraction and gas chromatography-mass spectrometric determination of probable carcinogen 1,4-dioxane in cosmetic products.","In the present work, a method based on solvent extraction and gas chromatography-mass spectrometry (GC-MS) has been validated for the determination of 1,4-dioxane in cosmetics. Various solvents including ethyl acetate, hexane, methanol, dichloromethane and acetone have been used for the extraction of 1,4-dioxane, among them the ethyl acetate was found to be the most efficient extracting solvent. This method has offered excellent quality parameters for instance linearity (R<sup>2</sup> > 0.9991), limit of detection (LOD, 0.00065-0.00091 µg/mL), limit of quantification (LOQ, 0.00217-0.00304 µg/mL) and, precision intra-day (1.65-2.60%, n = 5) and inter-day (0.16-0.32%, n = 5) in terms of relative standard deviation (RSD%). A total of thirty-nine cosmetic samples of different brands and origin have been studied. Among them, the 1,4-dioxane was found in twenty-three samples (FB<sub>1</sub>-FB<sub>7</sub>, MC<sub>1</sub>-MC<sub>4</sub>, MC<sub>6</sub>-MC<sub>8</sub>, HS<sub>3</sub>, HS<sub>5</sub>, BL<sub>1</sub>-BL<sub>3</sub>, BL<sub>5</sub> and PLD<sub>1</sub>-PLD<sub>3</sub>) at the levels between 0.15 µg/mL and 9.92 µg/mL, whereas in sixteen samples (MC<sub>5</sub>, HS<sub>1</sub>, HS<sub>2</sub>, SG<sub>1</sub>-SG<sub>5</sub>, BL<sub>4</sub> and HP<sub>1</sub>- HP<sub>6</sub>) was found to be not detected. The recovery values were achieved between 93% and 99% in both low and high level of spiked samples. In comparison to the traditional analytical techniques, the proposed method was found to be very sensitive and cost-effective for the routine analysis of 1,4-dioxane at low concentration in cosmetics.",2020,Scientific reports,dioxane,unspecified,carcinogenicity,unspecified,unspecified,cosmetics product study | analytical/method study,,
32228961,Rutin-loaded cellulose acetate/poly(ethylene oxide) fiber membrane fabricated by electrospinning: A bioactive material.,"Considering its health benefits, rutin provides promising applications in the pharmaceutical and cosmetic industries. However, the low bioavailability and low water solubility limit its application and remain to be resolved. In this study, cellulose acetate/poly(ethylene oxide) (CA/PEO) fiber was used as carrier for releasing it to relieve these problems. Bioactive fiber membrane was prepared by mixing it with CA/PEO solution. The surface morphology, encapsulation efficiency, antioxidant activity, antibacterial, and drug release of the rutin-loaded fiber membranes were studied. And the characteristics of the membranes were evaluated by the molecular interaction, thermal stability and mechanical properties. The results reveal that the fiber membrane loaded with 1.2 wt% rutin exhibited antioxidant activity of 98.3% and antibacterial properties of 93.5% and 95.0% against E. coli and S. aureus, respectively. Rutin release profiles were best fitted to Korsmeyer-Peppas model, and the fiber membrane released about 90% of rutin after 4 h. This indicates that rutin-loaded CA/PEO fiber membrane is a potential bioactive material.",2020,"Materials science & engineering. C, Materials for biological applications",dioxane,eye,oxidative stress,unspecified,unspecified,cosmetics product study,,
31405575,"The determination of 1,4-dioxane in cosmetic products by gas chromatography with tandem mass spectrometry.","1,4-dioxane is a potential human carcinogen and contaminant produced during the manufacturing process from specific cosmetic ingredients, such as certain detergents and emulsifiers. As such, 1,4-dioxane is not identified on product ingredient labels. To assess the concentration of 1,4-dioxane in cosmetic products, a gas chromatography-tandem mass spectrometry (GC-MS/MS) method using pulsed split injection and electron ionization was developed and validated. For liquid cosmetic products such as shampoo and lotion, test portions were extracted using fast ultrasound-assisted extraction (UAE) procedure without sample cleanup. For solid products (e.g. beauty bars), a C<sub>18</sub> solid phase extraction (SPE) procedure was optimized to reduce potential interferences. The corresponding stable isotopically labeled analogue (1,4-dioxane-d<sub>8</sub>) was selected as an internal standard to compensate for matrix effects and sample recovery. Method recovery experiments were performed in lotion, oil gel, hair detangler, bubble bath and beauty bar (solid) sample matrices with recoveries of 84-108% and relative standard deviations less than 5% at three spike concentrations. Method limits of detection (LOD) and quantification (LOQ) for 1,4-dioxane were determined at 0.2 μg/g and 0.5 μg/g, respectively. The method was successfully used to determine 1,4-dioxane in 82 leave-on and rinse-off cosmetic products marketed toward children including bath products, hair treatment, lotions, beauty bars, washes, shampoos, and other products. 1,4-dioxane was detected in 47 of the 82 products with an average concentration of 1.54 μg/g (range: 0.23-15.3 μg/g). The method can increase sample throughput and reduce matrix-induced interferences.",2019,Journal of chromatography. A,dioxane,unspecified,carcinogenicity,shampoo | body wash,unspecified,cosmetics product study | hair product study | skin/topical study | analytical/method study,,
30909033,An insight into toxicity and human-health-related adverse consequences of cosmeceuticals - A review.,"In recent years, the use of cosmeceutical-based personal care and beauty products has ever increased, around the world. Currently, an increasing number of compounds are being assimilated in the formulation of cosmetic products as preservatives, fragrances, surfactants, etc. to intensify the performance, quality, value, and lifespan of cosmetics. Nevertheless, many of these chemical additives pose toxic effects to the human body, exhibiting health risks from a mild hypersensitivity to life-threatening anaphylaxis or lethal intoxication. Therefore, the indiscriminate application of cosmeceuticals has recently become a mounting issue confronting public health. The present review focuses on exposure to a large variety of toxic substances used in cosmetic formulations such as 1,4-dioxane formaldehyde, paraformaldehyde, benzalkonium chloride, imidazolidinyl urea, diazolidinyl urea, trace heavy metals, parabens derivatives, phthalates, isothiazolinone derivatives (methylchloroiso-thiazolinone, and methylisothiazolinone), methyldibromo glutaronitrile, and phenoxy-ethanol. The biological risks related to these substances that they can pose to human health in terms of cytotoxicity, genotoxicity, mutagenicity, neurotoxicity oestrogenicity or others are also discussed. Researchers from academia, consultancy firms, governmental organizations, and cosmetic companies should carry out further progress to keep updating the consumers regarding the dark-sides, and health-related harmful apprehensions of cosmetics. In addition, the industry-motivated initiatives to abate environmental impact through green, sustainable and eco-friendly product development grasp significant perspective.",2019,The Science of the total environment,dioxane,brain,endocrine disruption | neurotoxicity | genotoxicity,unspecified,unspecified,cosmetics product study,,
30820197,"Immediate hypersensitivity to polyethylene glycols in unrelated products: when standardization in the nomenclature of the components of drugs, cosmetics, and food becomes necessary.","Polyethylene glycols (PEGs) and their derivatives are non-ionic polymers of ethylene oxide commercially available with numerous synonyms, such as macrogol, oxyethylene polymer, and laureth-9. Although these polymers are usually safe, mild to life-threatening immediate-type hypersensitivity reactions have been reported. Nevertheless, awareness about their allergic potential is minimal due to the non-standardization of their nomenclature. We present the case of a 29-years-old woman who developed several local and systemic type I hypersensitivity reactions including a severe anaphylactic reaction to different pharmacologic and cosmetic products whose excipients included PEG. Prick tests and basophil activation tests were performed to several pharmacological and cosmetic products, but only those containing PEGs and their derivatives were positive. The patient was diagnosed with immediate hypersensitivity IgE-mediated to PEGs and its derivatives. Standardization of the terminology used to describe the presence of PEGs in products would help patients to identify them clearly and unequivocally and thus avoid the development of hypersensitivity reactions. It is also recommended studying PEG allergy in reactions to products containing PEGs, once allergy to the active ingredients has been excluded and in reactions to multiple unrelated drugs.<i>Clinical study protocol number</i> PI2018/29 (registered on 24 September 2018).",2019,"Allergy, asthma, and clinical immunology : official journal of the Canadian Society of Allergy and Clinical Immunology",dioxane,immune system,unspecified,unspecified,unspecified,cosmetics product study | clinical/hospital study,,
30559416,The molecular structure of plant sporopollenin.,"Sporopollenin is a ubiquitous and extremely chemically inert biopolymer that constitutes the outer wall of all land-plant spores and pollen grains<sup>1</sup>. Sporopollenin protects the vulnerable plant gametes against a wide range of environmental assaults, and is considered a prerequisite for the migration of early plants onto land<sup>2</sup>. Despite its importance, the chemical structure of plant sporopollenin has remained elusive<sup>1</sup>. Using a newly developed thioacidolysis degradative method together with state-of-the-art solid-state NMR techniques, we determined the detailed molecular structure of pine sporopollenin. We show that pine sporopollenin is primarily composed of aliphatic-polyketide-derived polyvinyl alcohol units and 7-O-p-coumaroylated C16 aliphatic units, crosslinked through a distinctive dioxane moiety featuring an acetal. Naringenin was also identified as a minor component of pine sporopollenin. This discovery answers the long-standing question about the chemical make-up of plant sporopollenin, laying the foundation for future investigations of sporopollenin biosynthesis and for the design of new biomimetic polymers with desirable inert properties.",2019,Nature plants,dioxane,unspecified,unspecified,foundation,unspecified,cosmetics product study,,
