pmid,title,abstract,pub_year,journal,toxicant,organs,health_effects,products,ingredients,inference
37378354,Stability of retinol in liposomes as measured by fluorescence lifetime spectroscopy and FLIM.,"Retinol shows complex photophysical properties that make it potentially useful as an exogenous or endogenous probe of membrane microenvironment, but it has not been fully explored. In this study, we use bulk fluorescence lifetime measurements and fluorescence lifetime imaging microscopy (FLIM) to examine the stability of retinol in phosphatidylcholine (PC) multilamellar and unilamellar vesicles with and without cholesterol. We find that both light and exposure to ambient temperature and oxygen contribute to retinol degradation, with the addition of an antioxidant such as butylated hydroxytoluene (BHT) essential to provide stability, especially in the absence of cholesterol. With exposure to ultraviolet light to excite its native fluorescence, retinol degrades rapidly and can photosensitize vesicles. Degradation can be measured by a decrease in fluorescence lifetime. In POPC vesicles without cholesterol, BHT leads to initially higher lifetimes compared with no BHT, but it increases the rate of photodegradation. The presence of 10 mol % cholesterol protects against this effect, and vesicles with 20 mol % cholesterol show longer lifetimes without BHT under all conditions. Because of its environmental sensitivity, retinol is interesting as a FLIM probe, but careful controls are needed to avoid degradation, and additional work is needed to optimize liposomes for food and cosmetic applications.",2023,BBA advances,bha_bht,unspecified,oxidative stress,unspecified,retinol,cosmetics product study
36903283,A Novel Approach in Skin Care: By-Product Extracts as Natural UV Filters and an Alternative to Synthetic Ones.,"The cosmetic industry has been focusing on replacing synthetic ingredients with natural ones, taking advantage of their bioactive compounds. This work assessed the biological properties of onion peel (OP) and passion fruit peel (PFP) extracts in topical formulations as an alternative to synthetic antioxidants and UV filters. The extracts were characterized regarding their antioxidant capacity, antibacterial capacity and sun protection factor (SPF) value. Results revealed that the OP extract exhibited better results, which can result from the high concentrations of quercetin, as identified and quantified in HPLC analysis. Afterward, nine formulations of O/W creams were produced with minor changes in the quantity of additives: OP and PFP extract (natural antioxidants and UV filters), BHT (synthetic antioxidant) and oxybenzone (synthetic UV filter). The stability of the formulations was determined for 28 days; it was verified that they remained stable throughout the study period. The assays of the formulations' antioxidant capacity and SPF value revealed that OP and PFP extracts have some photoprotective properties and are excellent sources of antioxidants. As a result, they can be incorporated in daily moisturizers with SPF and sunscreens replacing and/or diminishing the quantities of synthetic ingredients, reducing their negative effects on human health and the environment.",2023,"Molecules (Basel, Switzerland)",bha_bht,skin,oxidative stress,moisturizer | sunscreen,unspecified,cosmetics product study | sunscreen/UV filter study | skin/topical study | food/dietary exposure | analytical/method study
36829780,A Green Lipophilization Reaction of a Natural Antioxidant.,"A natural antioxidant, widely spread in plants, chlorogenic acid (CGA), can be lipophilized through a heterogeneous, non-enzymatic, catalytic process. Thus, sulfonic resins under no solvent conditions allow to obtain a series of esters in up to 93% yield through reaction of CGA with fatty alcohols of different chain length. The reaction takes place in one single step under mild conditions with conversions up to 96% and selectivity up to 99%. Product recovery in high purity was very easy and the esters obtained were fully characterized with spectroscopic techniques and through the DPPH test to verify the preservation of antioxidant activity. According to this test, all of them showed increased activity with respect to the parent acid and anyway higher than butylated hydroxyanisole. An in-silico method also suggested their very low toxicity. The increased lipophilicity of the esters allows their formulation in cosmetic and nutraceutic lipid-based products.",2023,"Antioxidants (Basel, Switzerland)",bha_bht,unspecified,oxidative stress,unspecified,unspecified,cosmetics product study
36422711,A MWCNTs-COOH/PSS nanocomposite-modified screen-printed electrode for the determination of synthetic phenolic antioxidants by HPLC with amperometric detection.,"New sensing platforms based on screen-printed carbon electrodes modified with composites based on polystyrene sulfonate and oxidized multi-walled carbon nanotubes (PSS/MWCNTs-COOH/SPCE) have been used to develop a novel HPLC method with electrochemical detection (ECD) for the determination of the most used synthetic phenolic antioxidants in cosmetics: butylhydroxytoluene (BHT), butylhydroxyanisole (BHA), tert-butylhydroquinone (TBHQ) and propyl gallate (PG). Optimal separation conditions were achieved using methanol: 0.10 mol L<sup>-1</sup> acetate solution at pH 6 as mobile phase with a gradient elution program from 60 to 90% of methanol percentage in 15 min. The electrochemical detection was carried out in amperometric mode using the PSS/MWCNTs-COOH/SPCE at + 0.80 V vs. Ag. Under these optimal separation and detection conditions, the limits of detection (LOD) were between 0.11 and 0.25 mg L<sup>-1</sup>. These LOD values were better, especially for BHT, than those previously published in other HPLC methods. Linear ranges from 0.37 mg L<sup>-1</sup>, 0.83 mg L<sup>-1</sup>, 0.69 mg L<sup>-1</sup> and 0.56 mg L<sup>-1</sup> to 10 mg L<sup>-1</sup> were obtained for PG, TBHQ, BHA and BHT, respectively. RSD values equal or lower than 5% and 8% were achieved for repeatability and reproducibility, respectively. The HPLC-ECD method was successfully applied to analyze different cosmetic samples. Recovery values within 83-109% were obtained in the validation studies.",2022,Mikrochimica acta,bha_bht,unspecified,oxidative stress,unspecified,unspecified,cosmetics product study | analytical/method study
36066805,"4,4'-Diaponeurosporene Production as C<sub>30</sub> Carotenoid with Antioxidant Activity in Recombinant Escherichia coli.","Carotenoids, a group of isoprenoid pigments, are naturally synthesized by various microorganisms and plants, and are industrially used as ingredients in food, cosmetic, and pharmaceutical product formulations. Although several types of carotenoids and diverse microbial carotenoid producers have been reported, studies on lactic acid bacteria (LAB)-derived carotenoids are relatively insufficient. There is a notable lack of research focusing on C<sub>30</sub> carotenoids, the functional characterizations of their biosynthetic genes and their mass production by genetically engineered microorganisms. In this study, the biosynthesis of 4,4'-diaponeurosporene in Escherichia coli harboring the core biosynthetic genes, dehydrosqualene synthase (crtM) and dehydrosqualene desaturase (crtN), from Lactiplantibacillus plantarum subsp. plantarum KCCP11226 was constructed to evaluate and enhance 4,4'-diaponeurosporene production and antioxidant activity. The production of 4,4'-diapophytoene, a substrate of 4,4'-diaponeurosporene, was confirmed in E. coli expressing only the crtM gene. In addition, recombinant E. coli carrying both C<sub>30</sub> carotenoid biosynthesis genes (crtM and crtN) was confirmed to biosynthesize 4,4'-diaponeurosporene and exhibited a 6.1-fold increase in carotenoid production compared to the wild type and had a significantly higher antioxidant activity compared to synthetic antioxidant, butylated hydroxytoluene. This study presents the discovery of an important novel E. coli platform in consideration of the industrial applicability of carotenoids.",2023,Applied biochemistry and biotechnology,bha_bht,unspecified,oxidative stress,unspecified,lactic acid,cosmetics product study | industrial/occupational
35335146,Sustainability in Skin Care: Incorporation of Avocado Peel Extracts in Topical Formulations.,"The avocado peel is an agro-industrial by-product that has exhibited a massive increase in its production in the last few years. The reuse and valorisation of this by-product are essential since its disposal raises environmental concerns. In the present study, ethanolic extracts of avocado peels of the Hass variety were obtained, for three extraction times (1.5 h, 3 h and 4 h) and analysed for their antioxidant and antibacterial properties. Antioxidant evaluations of the extracts revealed that the extraction time of 1.5 h exhibited the best results amongst the three, with a DPPH inhibition percentage of 93.92 ± 1.29 and an IC<sub>50</sub> percentage, the necessary concentration of the extract to inhibit 50% of DPPH, of 37.30 ± 1.00. The antibacterial capacity of the extracts was evaluated and it was revealed that they were able to inhibit the growth and development of bacteria of the <i>Staphylococcus</i> family. The obtained extract was incorporated in two types of cosmetic formulations (oil-in-water and water-in-oil) and their stability was evaluated and compared with formulations containing synthetic preservatives (BHT and phenoxyethanol). The results of the stability evaluation suggest that the avocado peel extract has the potential to be incorporated in both types of emulsions, acting as an antioxidant and antibacterial agent, proving it to be a viable option to reduce/replace the use of synthetic preservatives. Furthermore, the avocado peel extract proved to be more effective and stable in oil-in-water emulsions. These results highlight the possibility of obtaining sustainable cosmetics, significantly reducing the negative impacts on the environment by the incorporation of extracts sourced from the avocado peel, an interesting source of phenolic compounds, an abundant and low-cost by-product.",2022,"Molecules (Basel, Switzerland)",bha_bht,skin,oxidative stress,unspecified,phenoxyethanol,cosmetics product study | skin/topical study | industrial/occupational
34817919,Monophasic versus biphasic hyaluronic acid filler for correcting nasolabial folds: a systematic review and meta-analysis.,"Hyaluronic acid (HA) fillers are the most popular dermal fillers for wrinkle correction and facial rejuvenation. Recently, there has been an interest toward classifying HA fillers based on the cross-linking properties into monophasic (MHA) and biphasic (BHA) fillers. We aimed to compare the efficacy and safety outcomes between MHA and BHA fillers for the correction of nasolabial folds (NLFs). We searched Medline, Embase, and CENTRAL for randomized controlled trials (RCTs) that compared MHA filler to BHA filler for individuals with moderate-to-severe bilateral NLFs. We sought to evaluate the following outcomes: Wrinkle severity rating scale (WSRS), pain on visual analog scale (VAS), global aesthetic improvement scale (GAIS), and adverse events. The standardized mean difference (SMD) was used to represent continuous outcomes while risk ratio (RR) was used to represent dichotomous outcomes. A total of 11 RCTs that enrolled 935 participants deemed eligible. MHA filler revealed a significant improvement in the overall WSRS score and GAIS score compared to BHA filler (SMD = -0.38, 95% CI -0.49 to -0.27 and SMD = 0.34, 95% CI 0.24-0.45, respectively). No significant difference was noted between MHA and BHA fillers in terms of pain score or adverse events (SMD = -0.39, 95% CI -0.81-0.03 and RR = 1.00, 95% CI 0.89-1.12, respectively). MHA filler showed discernable cosmetic results and comparable effective and tolerability to BHA filler.",2022,Journal of cosmetic dermatology,bha_bht,skin,unspecified,unspecified,hyaluronic acid,cosmetics product study
34599667,"Towards standard methods for the classification of aquatic toxicity for biologically active household chemicals (BAHC) present in plastics, pharmaceuticals, and cosmetic products.","A standard method to test the aquatic toxicity of biologically active household chemicals (BAHC), including those with very low water solubility, is proposed. The method uses the common marine models Paracentrotus lividus embryos and Acartia clausi larvae, in order to advance towards derivation of water quality criteria for these emerging pollutants that currently lack environmental standards. Depending on the water solubility and octanol-water partition coefficient (K<sub>ow</sub>) of the substance, the protocol consists of testing the toxicity of the substances by serial dilutions of water stocks, dimethyl-sulfoxide stocks, or 100 mg/L lixiviates in seawater. When this method is applied to eleven model BAHC, the pharmaceutical fluoxetine, the antioxidant butylated hydroxytoluene, and the UV filters broadly present in cosmetics octocrylene and 4-methylbenzylidene camphor, are classified as very toxic to aquatic life, since their EC<sub>50</sub> values are < 1 mg/L. In general, both biological models, P. lividus and A. clausi, yield the same classification of the substances tested, but variations in the classification of aquatic toxicity depending on methodological aspects are discussed. The use of A. clausi nauplii provides more protecting value to the toxicity parameters obtained by using this protocol.",2021,Environmental monitoring and assessment,bha_bht,unspecified,oxidative stress,sunscreen,sunscreen agent,cosmetics product study | sunscreen/UV filter study
34500670,Absolute Antioxidant Activity of Five Phenol-Rich Essential Oils.,"Essential oils (EOs) have promising antioxidant activities which are gaining interest as natural alternatives to synthetic antioxidants in the food and cosmetic industries. However, quantitative data on chain-breaking activity and on the kinetics of peroxyl radical trapping are missing. Five phenol-rich EOs were analyzed by GC-MS and studied by oxygen-uptake kinetics in inhibited controlled autoxidations of reference substrates (cumene and squalene). Terpene-rich <i>Thymus vulgaris</i> (thymol 4%; carvacrol 33.9%), <i>Origanum vulgare</i>, (thymol 0.4%; carvacrol 66.2%) and <i>Satureja hortensis</i>, (thymol 1.7%; carvacrol 46.6%), had apparent <i>k</i><sub>inh</sub> (30 °C, PhCl) of (1.5 ± 0.3) × 10<sup>4</sup>, (1.3 ± 0.1) × 10<sup>4</sup> and (1.1 ± 0.3) × 10<sup>4</sup> M<sup>-1</sup>s<sup>-1</sup>, respectively, while phenylpropanoid-rich <i>Eugenia caryophyllus</i> (eugenol 80.8%) and <i>Cinnamomum zeylanicum</i>, (eugenol 81.4%) showed apparent <i>k</i><sub>inh</sub> (30 °C, PhCl) of (5.0 ± 0.1) × 10<sup>3</sup> and (4.9 ± 0.3) × 10<sup>3</sup> M<sup>-1</sup>s<sup>-1</sup>, respectively. All EOs already granted good antioxidant protection of cumene at a concentration of 1 ppm (1 mg/L), the duration being proportional to their phenolic content, which dictated their antioxidant behavior. They also afforded excellent protection of squalene after adjusting their concentration (100 mg/L) to account for the much higher oxidizability of this substrate. All investigated EOs had <i>k</i><sub>inh</sub> comparable to synthetic butylated hydroxytoluene (BHT) were are eligible to replace it in the protection of food or cosmetic products.",2021,"Molecules (Basel, Switzerland)",bha_bht,unspecified,oxidative stress,unspecified,unspecified,cosmetics product study | analytical/method study
34236286,"Maculosin, a non-toxic antioxidant compound isolated from <i>Streptomyces</i> sp. KTM18.","<i>Streptomyces</i> species are prolific sources of bioactive secondary metabolites known especially for their antimicrobial and anticancer activities. This study sought to isolate and characterize antioxidant molecules biosynthesized by <i>Streptomyces</i> sp. KTM18. The antioxidant potential of an isolated compound and its toxicity were accessed. The compound was purified using bioassay-guided chromatography techniques. Nuclear magnetic resonance (NMR) experiments were carried out for structure elucidation. The antioxidant potential of the isolated compound was determined using DPPH free radical scavenging assay. The toxicity of the isolated compound was measured using a brine shrimp lethality (BSL) assay. Ethyl acetate extract of <i>Streptomyces</i> sp. KTM18 showed more than 90% inhibition of DPPH free radical at 50 µg/mL of the test concentration. These data were the strongest among 13 <i>Streptomyces</i> isolates (KTM12-KTM24). The active molecule was isolated and characterized as maculosin (molecular formula, C<sub>14</sub>H<sub>16</sub>N<sub>2</sub>O<sub>3</sub> as determined by the [M + H]<sup>+</sup> peak at 261.1259). The DPPH free radical scavenging activity of pure maculosin was higher (IC<sub>50</sub>, 2.16 ± 0.05 µg/mL) than that of commercial butylated hydroxyanisole (BHA) (IC<sub>50</sub>, 4.8 ± 0.05 µg/mL). No toxicity was observed for maculosin (LD<sub>50</sub>, <128 µg/mL) in brine shrimp lethality assay (BSLA) up to the compound's antioxidant activity (IC<sub>50</sub>) concentration range. The commercial standard, berberine chloride, showed toxicity in BSLA with an LD<sub>50</sub> value of 8.63 ± 0.15 µg/mL. Maculosin may be a leading drug candidate in various cosmetic and therapeutic applications owing to its strong antioxidant and non-toxic properties.",2021,Pharmaceutical biology,bha_bht,unspecified,carcinogenicity | oxidative stress,unspecified,unspecified,cosmetics product study | clinical/hospital study | analytical/method study
33851255,"A Single-Center, Randomized, Double-Blind Clinical Trial to Compare the Efficacy and Safety of a New Monophasic Hyaluronic Acid Filler and Biphasic Filler in Correcting Nasolabial Fold.","Hyaluronic acid (HA) fillers have been widely used in humans since 1958 because of their biomedical safety. Restylane<sup>®</sup> was introduced in the1990s as a favorable temporary filler option for facial augmentation. Subsequently, many new HA filler products, including the Sardenyashape<sup>®</sup>, have been introduced, but comparative studies of these products are limited. Here, we compared tolerability (wrinkle severity rating scale, WSRS), pain (visual analog scale, VAS score), satisfaction (global esthetic improvement scale, GAIS), and safety of a new monophasic HA (MHA) filler (Sardenyashape<sup>®</sup>) containing lidocaine, used to correct nasolabial folds (NLFs), with those of biphasic HA (BHA) filler (Restylane LYFT<sup>®</sup>) containing lidocaine. We enrolled 96 participants with visible NLFs in this randomized, double-blind, single-center clinical study. Participants were injected with a new MHA filler in one NLF and a BHA filler and were reassessed for cosmetic changes at 8 and 24 weeks. Wrinkle severity was assessed using the 5-point WSRS. At week 24, the mean improvement in WSRS compared to baseline was 1.92 ± 0.75 and 2.24 ± 0.66 for MHA and BHA fillers, respectively, and corresponding average pain values using the VAS score 30 min after the procedure were 0.04 ± 0.25 and 0.02 ± 0.15, respectively, showing no significant difference. Average GAIS values 8 weeks after the procedure with MHA and BHA fillers were 1.89 ± 0.77 and 1.40 ± 0.82, respectively (p < 0.001). Both fillers were well tolerated, with mild adverse reactions. The evaluation of the effect of Sardenyashape<sup>®</sup> with lidocaine on NLF in this study proved its effectiveness and safety for use in correcting NLF. This journal requires that authors assign a level of evidence to each article. For a full description of these Evidence-Based Medicine ratings, please refer to the Table of Contents or the online Instructions to Authors www.springer.com/00266 .",2021,Aesthetic plastic surgery,bha_bht,unspecified,unspecified,unspecified,hyaluronic acid,cosmetics product study | clinical/hospital study
32792780,"""Combination Grafting"" of Scalp and Body Hair to Enhance the Visual Density of Hair Transplant and Coverage of Higher Grade of Baldness.","Hair transplant is becoming the most common cosmetic procedure across the world with demand for higher density and coverage of baldness. This needs more number of donor hair follicles. Scalp donor has limitations to fulfill the required number of follicles for Norwood Grade VI and VII baldness. The body hair follicles can be used to cover up the deficit. The objective of this study was to observe the use of body hair follicles to increase the visual density and for better coverage for higher grades of baldness as an adjuvant to scalp hair follicles. A total of 16 patients were evaluated for the availability of body donor hair, and consent for body hair harvesting was obtained from them. The beard was the first preference and then chest and abdomen hair follicles were used in combination with scalp hair follicles to cover bald area of Norwood grade IV and above baldness. Body hairs were harvested using follicular unit extraction (FUE) technique. Postoperative pictures were taken, and patient satisfaction, doctor's observation, and global photographic evaluation was carried out. The patient's photographs were taken after 4, 8, and 12 months of hair transplant. The results were analyzed on the basis of global photography. The use of body hair with scalp has enhanced the visual density, leaving to better coverage in even higher grades of baldness.",2020,Journal of cutaneous and aesthetic surgery,bha_bht,ovary,unspecified,unspecified,unspecified,cosmetics product study | clinical/hospital study
32619281,A minimally invasive clinical model to test sunscreen toxicity based on oxidative stress levels using microbiopsy and confocal microscopy - a proof of concept study.,This proof-of-concept study demonstrated that using minimally invasive skin microsampling could enable significantly higher throughput of cosmetic testing in volunteers than conventional biopsy. Nanoparticle sunscreen was used as a model to test toxicity based on oxidative stress using microbiopsy and confocal imaging. Six volunteers were recruited for this study (3 males and 3 females). Zinc oxide nanoparticle containing topical formulation was prepared at 10% w/v. Each volunteer had 3 areas of 4 cm<sup>2</sup> each mapped on each inner forearm for a total of 6 treatment areas (intact/ tape-stripped and with/without treatment). The topical zinc-nanoparticle formulation was applied directly to volunteer skin (2mg/cm<sup>2</sup> ) for 2 hrs. Microbiopsied tissue from each treatment group was stained for reactive oxygen and nitrogen species in addition to mitochondrial superoxide. The stained samples were then imaged using confocal microscopy prior to image analysis. Skin exposed to zinc oxide nanoparticles did not show any significant increases in oxidative stress. Zinc oxide nanoparticle tape-stripped skin resulted in signal significantly lower (P < 0.001) oxidative stress levels than t-butylated hydroxytoluene treated tape-stripped skin for oxidative stress markers. Topically applied zinc oxide nanoparticles had no detectable effect on the oxidative status in volunteer skin. No adverse reactions or effects were observed after all treatments including microbiopsy. The data support the hypothesis that microbiopsy is a viable approach to study cosmeceutical- skin interactions in volunteers with capacity for molecular assays and high throughput with very low risk to the volunteer.,2020,International journal of cosmetic science,bha_bht,skin,oxidative stress,sunscreen,zinc oxide,cosmetics product study | sunscreen/UV filter study | skin/topical study
32397407,Computational Methods for the Identification of Molecular Targets of Toxic Food Additives. Butylated Hydroxytoluene as a Case Study.,"Butylated hydroxytoluene (BHT) is one of the most commonly used synthetic antioxidants in food, cosmetic, pharmaceutical and petrochemical products. BHT is considered safe for human health; however, its widespread use together with the potential toxicological effects have increased consumers concern about the use of this synthetic food additive. In addition, the estimated daily intake of BHT has been demonstrated to exceed the recommended acceptable threshold. In the present work, using BHT as a case study, the usefulness of computational techniques, such as reverse screening and molecular docking, in identifying protein-ligand interactions of food additives at the bases of their toxicological effects has been probed. The computational methods here employed have been useful for the identification of several potential unknown targets of BHT, suggesting a possible explanation for its toxic effects. In silico analyses can be employed to identify new macromolecular targets of synthetic food additives and to explore their functional mechanisms or side effects. Noteworthy, this could be important for the cases in which there is an evident lack of experimental studies, as is the case for BHT.",2020,"Molecules (Basel, Switzerland)",bha_bht,unspecified,oxidative stress,unspecified,unspecified,cosmetics product study
